{
  "$schema": "https://json-schema.org/draft/2020-12/schema",
  "title": "AtlasTable",
  "type": "object",
  "additionalProperties": false,
  "required": ["tileWidth", "tileHeight", "heightStep", "atlases", "cells"],
  "properties": {
    "$schema": { "type": "string" },
    "tileWidth": { "type": "integer", "minimum": 1 },
    "tileHeight": { "type": "integer", "minimum": 1 },
    "heightStep": { "type": "integer", "minimum": 0 },
    "atlases": {
      "type": "array",
      "minItems": 1,
      "items": {
        "type": "object",
        "additionalProperties": false,
        "required": ["id", "file", "width", "height"],
        "properties": {
          "id": { "type": "string", "pattern": "^[a-z][a-z0-9_]*$" },
          "file": { "type": "string", "minLength": 1 },
          "width": { "type": "integer", "minimum": 1 },
          "height": { "type": "integer", "minimum": 1 }
        }
      }
    },
    "cells": {
      "type": "array",
      "minItems": 1,
      "items": {
        "type": "object",
        "additionalProperties": false,
        "required": ["id", "atlas", "kind", "x", "y", "w", "h", "originX", "originY", "height", "variant"],
        "properties": {
          "id": { "type": "string", "pattern": "^[a-z][a-z0-9_]*$" },
          "atlas": { "type": "string", "pattern": "^[a-z][a-z0-9_]*$" },
          "kind": { "enum": ["tile", "object", "building", "overlay"] },
          "x": { "type": "integer", "minimum": 0 },
          "y": { "type": "integer", "minimum": 0 },
          "w": { "type": "integer", "minimum": 1 },
          "h": { "type": "integer", "minimum": 1 },
          "originX": { "type": "integer", "minimum": 0, "description": "Cell pixel on the ground diamond centre; for kind building: x of the bottom corner of the footprint diamond (frame width / 2)." },
          "originY": { "type": "integer", "minimum": 0, "description": "Cell pixel on the ground diamond centre; for kind building: y of the bottom corner of the footprint diamond (frame height - 1)." },
          "height": { "type": "integer", "minimum": 0, "maximum": 3 },
          "variant": { "type": "integer", "minimum": 0, "description": "Colour variant of a tile; for kind building: construction stage 0..3 (marking, planks, scaffolding, finished)." }
        }
      }
    }
  }
}
