{
  "$schema": "./atlas.schema.json",
  "tileWidth": 64,
  "tileHeight": 32,
  "heightStep": 16,
  "atlases": [
    { "id": "tiles", "file": "art/atlas_tiles.png", "width": 640, "height": 352 },
    { "id": "objects", "file": "art/atlas_objects.png", "width": 192, "height": 192 }
  ],
  "cells": [
    { "id": "meadow_h0_v0", "atlas": "tiles", "kind": "tile", "x": 0, "y": 0, "w": 64, "h": 32, "originX": 32, "originY": 16, "height": 0, "variant": 0 },
    { "id": "meadow_h0_v1", "atlas": "tiles", "kind": "tile", "x": 64, "y": 0, "w": 64, "h": 32, "originX": 32, "originY": 16, "height": 0, "variant": 1 },
    { "id": "meadow_h0_v2", "atlas": "tiles", "kind": "tile", "x": 128, "y": 0, "w": 64, "h": 32, "originX": 32, "originY": 16, "height": 0, "variant": 2 },
    { "id": "forest_h0_v0", "atlas": "tiles", "kind": "tile", "x": 192, "y": 0, "w": 64, "h": 32, "originX": 32, "originY": 16, "height": 0, "variant": 0 },
    { "id": "forest_h0_v1", "atlas": "tiles", "kind": "tile", "x": 256, "y": 0, "w": 64, "h": 32, "originX": 32, "originY": 16, "height": 0, "variant": 1 },
    { "id": "forest_h0_v2", "atlas": "tiles", "kind": "tile", "x": 320, "y": 0, "w": 64, "h": 32, "originX": 32, "originY": 16, "height": 0, "variant": 2 },
    { "id": "mountain_h0_v0", "atlas": "tiles", "kind": "tile", "x": 384, "y": 0, "w": 64, "h": 32, "originX": 32, "originY": 16, "height": 0, "variant": 0 },
    { "id": "mountain_h0_v1", "atlas": "tiles", "kind": "tile", "x": 448, "y": 0, "w": 64, "h": 32, "originX": 32, "originY": 16, "height": 0, "variant": 1 },
    { "id": "mountain_h0_v2", "atlas": "tiles", "kind": "tile", "x": 512, "y": 0, "w": 64, "h": 32, "originX": 32, "originY": 16, "height": 0, "variant": 2 },
    { "id": "wasteland_h0_v0", "atlas": "tiles", "kind": "tile", "x": 576, "y": 0, "w": 64, "h": 32, "originX": 32, "originY": 16, "height": 0, "variant": 0 },
    { "id": "wasteland_h0_v1", "atlas": "tiles", "kind": "tile", "x": 0, "y": 32, "w": 64, "h": 32, "originX": 32, "originY": 16, "height": 0, "variant": 1 },
    { "id": "wasteland_h0_v2", "atlas": "tiles", "kind": "tile", "x": 64, "y": 32, "w": 64, "h": 32, "originX": 32, "originY": 16, "height": 0, "variant": 2 },
    { "id": "water_h0_v0", "atlas": "tiles", "kind": "tile", "x": 128, "y": 32, "w": 64, "h": 32, "originX": 32, "originY": 16, "height": 0, "variant": 0 },
    { "id": "water_h0_v1", "atlas": "tiles", "kind": "tile", "x": 192, "y": 32, "w": 64, "h": 32, "originX": 32, "originY": 16, "height": 0, "variant": 1 },
    { "id": "water_h0_v2", "atlas": "tiles", "kind": "tile", "x": 256, "y": 32, "w": 64, "h": 32, "originX": 32, "originY": 16, "height": 0, "variant": 2 },
    { "id": "river_h0_v0", "atlas": "tiles", "kind": "tile", "x": 320, "y": 32, "w": 64, "h": 32, "originX": 32, "originY": 16, "height": 0, "variant": 0 },
    { "id": "river_h0_v1", "atlas": "tiles", "kind": "tile", "x": 384, "y": 32, "w": 64, "h": 32, "originX": 32, "originY": 16, "height": 0, "variant": 1 },
    { "id": "river_h0_v2", "atlas": "tiles", "kind": "tile", "x": 448, "y": 32, "w": 64, "h": 32, "originX": 32, "originY": 16, "height": 0, "variant": 2 },
    { "id": "meadow_h1_v0", "atlas": "tiles", "kind": "tile", "x": 512, "y": 32, "w": 64, "h": 48, "originX": 32, "originY": 32, "height": 1, "variant": 0 },
    { "id": "meadow_h1_v1", "atlas": "tiles", "kind": "tile", "x": 576, "y": 32, "w": 64, "h": 48, "originX": 32, "originY": 32, "height": 1, "variant": 1 },
    { "id": "meadow_h1_v2", "atlas": "tiles", "kind": "tile", "x": 0, "y": 80, "w": 64, "h": 48, "originX": 32, "originY": 32, "height": 1, "variant": 2 },
    { "id": "forest_h1_v0", "atlas": "tiles", "kind": "tile", "x": 64, "y": 80, "w": 64, "h": 48, "originX": 32, "originY": 32, "height": 1, "variant": 0 },
    { "id": "forest_h1_v1", "atlas": "tiles", "kind": "tile", "x": 128, "y": 80, "w": 64, "h": 48, "originX": 32, "originY": 32, "height": 1, "variant": 1 },
    { "id": "forest_h1_v2", "atlas": "tiles", "kind": "tile", "x": 192, "y": 80, "w": 64, "h": 48, "originX": 32, "originY": 32, "height": 1, "variant": 2 },
    { "id": "mountain_h1_v0", "atlas": "tiles", "kind": "tile", "x": 256, "y": 80, "w": 64, "h": 48, "originX": 32, "originY": 32, "height": 1, "variant": 0 },
    { "id": "mountain_h1_v1", "atlas": "tiles", "kind": "tile", "x": 320, "y": 80, "w": 64, "h": 48, "originX": 32, "originY": 32, "height": 1, "variant": 1 },
    { "id": "mountain_h1_v2", "atlas": "tiles", "kind": "tile", "x": 384, "y": 80, "w": 64, "h": 48, "originX": 32, "originY": 32, "height": 1, "variant": 2 },
    { "id": "wasteland_h1_v0", "atlas": "tiles", "kind": "tile", "x": 448, "y": 80, "w": 64, "h": 48, "originX": 32, "originY": 32, "height": 1, "variant": 0 },
    { "id": "wasteland_h1_v1", "atlas": "tiles", "kind": "tile", "x": 512, "y": 80, "w": 64, "h": 48, "originX": 32, "originY": 32, "height": 1, "variant": 1 },
    { "id": "wasteland_h1_v2", "atlas": "tiles", "kind": "tile", "x": 576, "y": 80, "w": 64, "h": 48, "originX": 32, "originY": 32, "height": 1, "variant": 2 },
    { "id": "meadow_h2_v0", "atlas": "tiles", "kind": "tile", "x": 0, "y": 128, "w": 64, "h": 64, "originX": 32, "originY": 48, "height": 2, "variant": 0 },
    { "id": "meadow_h2_v1", "atlas": "tiles", "kind": "tile", "x": 64, "y": 128, "w": 64, "h": 64, "originX": 32, "originY": 48, "height": 2, "variant": 1 },
    { "id": "meadow_h2_v2", "atlas": "tiles", "kind": "tile", "x": 128, "y": 128, "w": 64, "h": 64, "originX": 32, "originY": 48, "height": 2, "variant": 2 },
    { "id": "forest_h2_v0", "atlas": "tiles", "kind": "tile", "x": 192, "y": 128, "w": 64, "h": 64, "originX": 32, "originY": 48, "height": 2, "variant": 0 },
    { "id": "forest_h2_v1", "atlas": "tiles", "kind": "tile", "x": 256, "y": 128, "w": 64, "h": 64, "originX": 32, "originY": 48, "height": 2, "variant": 1 },
    { "id": "forest_h2_v2", "atlas": "tiles", "kind": "tile", "x": 320, "y": 128, "w": 64, "h": 64, "originX": 32, "originY": 48, "height": 2, "variant": 2 },
    { "id": "mountain_h2_v0", "atlas": "tiles", "kind": "tile", "x": 384, "y": 128, "w": 64, "h": 64, "originX": 32, "originY": 48, "height": 2, "variant": 0 },
    { "id": "mountain_h2_v1", "atlas": "tiles", "kind": "tile", "x": 448, "y": 128, "w": 64, "h": 64, "originX": 32, "originY": 48, "height": 2, "variant": 1 },
    { "id": "mountain_h2_v2", "atlas": "tiles", "kind": "tile", "x": 512, "y": 128, "w": 64, "h": 64, "originX": 32, "originY": 48, "height": 2, "variant": 2 },
    { "id": "wasteland_h2_v0", "atlas": "tiles", "kind": "tile", "x": 576, "y": 128, "w": 64, "h": 64, "originX": 32, "originY": 48, "height": 2, "variant": 0 },
    { "id": "wasteland_h2_v1", "atlas": "tiles", "kind": "tile", "x": 0, "y": 192, "w": 64, "h": 64, "originX": 32, "originY": 48, "height": 2, "variant": 1 },
    { "id": "wasteland_h2_v2", "atlas": "tiles", "kind": "tile", "x": 64, "y": 192, "w": 64, "h": 64, "originX": 32, "originY": 48, "height": 2, "variant": 2 },
    { "id": "meadow_h3_v0", "atlas": "tiles", "kind": "tile", "x": 128, "y": 192, "w": 64, "h": 80, "originX": 32, "originY": 64, "height": 3, "variant": 0 },
    { "id": "meadow_h3_v1", "atlas": "tiles", "kind": "tile", "x": 192, "y": 192, "w": 64, "h": 80, "originX": 32, "originY": 64, "height": 3, "variant": 1 },
    { "id": "meadow_h3_v2", "atlas": "tiles", "kind": "tile", "x": 256, "y": 192, "w": 64, "h": 80, "originX": 32, "originY": 64, "height": 3, "variant": 2 },
    { "id": "forest_h3_v0", "atlas": "tiles", "kind": "tile", "x": 320, "y": 192, "w": 64, "h": 80, "originX": 32, "originY": 64, "height": 3, "variant": 0 },
    { "id": "forest_h3_v1", "atlas": "tiles", "kind": "tile", "x": 384, "y": 192, "w": 64, "h": 80, "originX": 32, "originY": 64, "height": 3, "variant": 1 },
    { "id": "forest_h3_v2", "atlas": "tiles", "kind": "tile", "x": 448, "y": 192, "w": 64, "h": 80, "originX": 32, "originY": 64, "height": 3, "variant": 2 },
    { "id": "mountain_h3_v0", "atlas": "tiles", "kind": "tile", "x": 512, "y": 192, "w": 64, "h": 80, "originX": 32, "originY": 64, "height": 3, "variant": 0 },
    { "id": "mountain_h3_v1", "atlas": "tiles", "kind": "tile", "x": 576, "y": 192, "w": 64, "h": 80, "originX": 32, "originY": 64, "height": 3, "variant": 1 },
    { "id": "mountain_h3_v2", "atlas": "tiles", "kind": "tile", "x": 0, "y": 272, "w": 64, "h": 80, "originX": 32, "originY": 64, "height": 3, "variant": 2 },
    { "id": "wasteland_h3_v0", "atlas": "tiles", "kind": "tile", "x": 64, "y": 272, "w": 64, "h": 80, "originX": 32, "originY": 64, "height": 3, "variant": 0 },
    { "id": "wasteland_h3_v1", "atlas": "tiles", "kind": "tile", "x": 128, "y": 272, "w": 64, "h": 80, "originX": 32, "originY": 64, "height": 3, "variant": 1 },
    { "id": "wasteland_h3_v2", "atlas": "tiles", "kind": "tile", "x": 192, "y": 272, "w": 64, "h": 80, "originX": 32, "originY": 64, "height": 3, "variant": 2 },
    { "id": "tree", "atlas": "objects", "kind": "object", "x": 0, "y": 0, "w": 64, "h": 64, "originX": 32, "originY": 48, "height": 0, "variant": 0 },
    { "id": "rock", "atlas": "objects", "kind": "object", "x": 64, "y": 0, "w": 64, "h": 64, "originX": 32, "originY": 48, "height": 0, "variant": 0 },
    { "id": "ore", "atlas": "objects", "kind": "object", "x": 128, "y": 0, "w": 64, "h": 64, "originX": 32, "originY": 48, "height": 0, "variant": 0 },
    { "id": "berry_bush", "atlas": "objects", "kind": "object", "x": 0, "y": 64, "w": 64, "h": 64, "originX": 32, "originY": 48, "height": 0, "variant": 0 },
    { "id": "poi_chest", "atlas": "objects", "kind": "object", "x": 64, "y": 64, "w": 64, "h": 64, "originX": 32, "originY": 48, "height": 0, "variant": 0 },
    { "id": "poi_ruins", "atlas": "objects", "kind": "object", "x": 128, "y": 64, "w": 64, "h": 64, "originX": 32, "originY": 48, "height": 0, "variant": 0 },
    { "id": "poi_lair", "atlas": "objects", "kind": "object", "x": 0, "y": 128, "w": 64, "h": 64, "originX": 32, "originY": 48, "height": 0, "variant": 0 },